{
  "$schema": "./node_modules/@qubbi/sdk-cli/schema/cli.json",
  "appModule": "./dist/app.module.js",
  "appModuleExport": "AppModule",
  "exportPackageName": "@qubbi/sdk",
  "swagger": {
    "openapi": "3.1",
    "info": {
      "title": "API",
      "description": "The API description",
      "version": "1.0"
    }
  }
}
